{
  "$schema": "https://json-schema.org/draft/2020-12/schema",
  "$id": "https://fermatmind.com/schemas/public-profile/public-profile-content-package.schema.json",
  "title": "Public Profile Content Package",
  "type": "object",
  "required": ["package_id", "framework", "entity_type", "code", "locale", "slug", "title", "summary", "seo", "canonical", "hreflang", "robots", "launch_state", "index_eligible", "sitemap_eligible", "llms_eligible", "sections", "faq", "media", "schema", "method_boundary", "evidence_notes", "internal_links", "source_ledger_refs", "model_output_refs", "last_reviewed_at"],
  "additionalProperties": false,
  "not": {
    "anyOf": [
      { "required": ["noindex"] },
      { "required": ["nofollow"] },
      { "required": ["indexable"] },
      { "required": ["allow_index"] },
      { "required": ["FAQ"] }
    ]
  },
  "properties": {
    "package_id": { "type": "string" },
    "framework": { "enum": ["mbti", "big_five", "enneagram", "future"] },
    "entity_type": { "type": "string" },
    "code": { "type": "string" },
    "locale": { "enum": ["en", "zh-CN"] },
    "slug": { "type": "string" },
    "title": { "type": "string" },
    "summary": { "type": "string" },
    "seo": {
      "type": "object",
      "required": ["title", "description"],
      "additionalProperties": false,
      "properties": {
        "title": { "type": "string" },
        "description": { "type": "string" }
      }
    },
    "canonical": {
      "type": "object",
      "required": ["path"],
      "additionalProperties": false,
      "properties": {
        "path": {
          "type": "string",
          "pattern": "^/(en|zh)/personality/big-five(?:/(?:openness|conscientiousness|extraversion|agreeableness|neuroticism|high-openness|low-openness|high-conscientiousness|low-conscientiousness|high-extraversion|low-extraversion|high-agreeableness|low-agreeableness|high-neuroticism|emotional-stability|facets))?$",
          "not": {
            "anyOf": [
              { "const": "/zh-CN/big-five/openness" },
              { "const": "/en/big-five/openness" }
            ]
          }
        }
      }
    },
    "hreflang": {
      "type": "object",
      "required": ["en", "zh-CN"],
      "additionalProperties": false,
      "properties": {
        "en": { "type": ["string", "null"] },
        "zh-CN": { "type": ["string", "null"] }
      }
    },
    "robots": { "enum": ["index,follow", "noindex,follow", "noindex,nofollow"] },
    "launch_state": { "enum": ["draft", "review", "approved", "content_stub", "content_ready", "published", "archived"] },
    "index_eligible": { "type": "boolean" },
    "sitemap_eligible": { "type": "boolean" },
    "llms_eligible": { "type": "boolean" },
    "sections": {
      "type": "array",
      "items": {
        "type": "object",
        "required": ["key", "title", "body", "evidence_ids"],
        "additionalProperties": false,
        "properties": {
          "key": { "type": "string" },
          "title": { "type": "string" },
          "body": { "type": "string" },
          "evidence_ids": { "type": "array", "items": { "type": "string" } }
        }
      }
    },
    "faq": {
      "type": "array",
      "items": {
        "type": "object",
        "required": ["id", "question", "answer", "evidence_ids"],
        "additionalProperties": false,
        "properties": {
          "id": { "type": "string" },
          "question": { "type": "string" },
          "answer": { "type": "string" },
          "evidence_ids": { "type": "array", "items": { "type": "string" } }
        }
      }
    },
    "media": { "type": "object" },
    "schema": { "type": "object" },
    "method_boundary": {
      "type": "object",
      "required": ["summary", "not_for"],
      "additionalProperties": false,
      "properties": {
        "summary": { "type": "string" },
        "not_for": { "type": "array", "items": { "type": "string" } }
      }
    },
    "evidence_notes": { "type": "array", "items": { "type": "string" } },
    "internal_links": {
      "type": "array",
      "items": {
        "type": "object",
        "required": ["label", "href"],
        "additionalProperties": false,
        "properties": {
          "label": { "type": "string" },
          "href": { "type": "string" },
          "relationship": { "type": ["string", "null"] }
        }
      }
    },
    "source_ledger_refs": { "type": "array", "items": { "type": "string" } },
    "model_output_refs": { "type": "array", "items": { "type": "string" } },
    "last_reviewed_at": { "type": ["string", "null"] }
  }
}
