{
  "package_id": "big_five:en:openness:editorial-repair-01",
  "framework": "big_five",
  "entity_type": "domain",
  "code": "openness",
  "locale": "en",
  "slug": "big-five/openness",
  "title": "Openness",
  "summary": "Openness describes stable tendencies around new experience, imagination, aesthetics, abstract ideas, and change, helping explain learning, communication, and adaptation patterns.",
  "seo": {
    "title": "Openness | Big Five guide",
    "description": "Openness describes stable tendencies around new experience, imagination, aesthetics, abstract ideas, and change, helping explain learning, communication, and adaptation patterns."
  },
  "canonical": {
    "path": "/en/personality/big-five/openness"
  },
  "hreflang": {
    "zh-CN": "/zh/personality/big-five/openness",
    "en": "/en/personality/big-five/openness"
  },
  "robots": "noindex,follow",
  "launch_state": "content_ready",
  "index_eligible": false,
  "sitemap_eligible": false,
  "llms_eligible": false,
  "sections": [
    {
      "key": "quick_answer",
      "title": "Quick answer",
      "body": "Openness concerns new experience, imagination, aesthetics, abstract ideas, and change. It is not a type label and does not rank ability.",
      "evidence_ids": [
        "A1",
        "A5"
      ]
    },
    {
      "key": "definition",
      "title": "What this domain covers",
      "body": "Openness is preference language for patterns in information choice, task handling, and communication rhythm.",
      "evidence_ids": [
        "A1",
        "A5"
      ]
    },
    {
      "key": "examples",
      "title": "Two concrete examples",
      "body": "testing several uses of a new tool; holding an unconventional idea long enough to understand it",
      "evidence_ids": [
        "A1",
        "A5"
      ]
    },
    {
      "key": "daily_signs",
      "title": "Daily signs",
      "body": "In daily life, Openness may appear in how you start tasks, handle feedback, manage change, and explain needs.",
      "evidence_ids": [
        "A1",
        "A5"
      ]
    },
    {
      "key": "higher_and_lower",
      "title": "Higher and lower patterns",
      "body": "Higher means the tendency is activated more readily. Lower often means more restraint, caution, or reliance on familiar patterns. Both sides can be useful.",
      "evidence_ids": [
        "A1",
        "A5"
      ]
    },
    {
      "key": "strengths_tradeoffs",
      "title": "Strengths and tradeoffs",
      "body": "The value of Openness depends on context. When well matched, it gives useful cues; when over-relied on, it can hide needs from the other side.",
      "evidence_ids": [
        "A1",
        "A5"
      ]
    },
    {
      "key": "work_learning",
      "title": "Work and learning",
      "body": "At work or in learning, Openness can describe preferred structure, feedback style, and collaboration rhythm.",
      "evidence_ids": [
        "A1",
        "A5"
      ]
    },
    {
      "key": "relationships",
      "title": "Relationships and communication",
      "body": "When discussing Openness, use concrete needs instead of labels.",
      "evidence_ids": [
        "A1",
        "A5"
      ]
    },
    {
      "key": "misunderstanding",
      "title": "Common misunderstanding",
      "body": "Openness is not intelligence or a guarantee of creativity; it describes how people approach new information and alternative viewpoints.",
      "evidence_ids": [
        "A1",
        "A5"
      ]
    },
    {
      "key": "action_prompt",
      "title": "Action prompt",
      "body": "Think of a recent situation: what did this domain help solve, and what did it make you miss?",
      "evidence_ids": [
        "I4"
      ]
    },
    {
      "key": "method_boundary",
      "title": "Method boundary",
      "body": "This page explains public knowledge about Openness. It does not interpret individual results and is not for diagnosis, therapy, hiring screening, ability judgment, or career decisions.",
      "evidence_ids": [
        "I4"
      ]
    },
    {
      "key": "related_links",
      "title": "Explore next",
      "body": "Continue to High Openness, Low Openness, and the 30-facet overview.",
      "evidence_ids": [
        "I4"
      ]
    }
  ],
  "faq": [
    {
      "id": "openness-meaning",
      "question": "What does Openness mainly describe?",
      "answer": "Openness describes tendencies around new experience, imagination, aesthetics, abstract ideas, and change in choices and communication.",
      "evidence_ids": [
        "A1"
      ]
    },
    {
      "id": "openness-poles",
      "question": "Is higher or lower better?",
      "answer": "No. Higher and lower are tendencies; usefulness depends on context.",
      "evidence_ids": [
        "A5"
      ]
    },
    {
      "id": "openness-observe",
      "question": "How can I observe this domain?",
      "answer": "Watch responses to stress, feedback, change, and collaboration rather than one behavior.",
      "evidence_ids": [
        "A5"
      ]
    },
    {
      "id": "openness-career",
      "question": "Can it decide work choices?",
      "answer": "No. It can provide preference clues, but cannot replace ability, experience, and opportunity.",
      "evidence_ids": [
        "I4"
      ]
    },
    {
      "id": "openness-facets",
      "question": "How does it relate to facets?",
      "answer": "Facets are narrower layers inside the broad domain.",
      "evidence_ids": [
        "A8"
      ]
    }
  ],
  "media": {
    "status": "placeholder",
    "image_url": null,
    "alt": "Neutral Big Five placeholder visual for Openness; not an MBTI-branded image."
  },
  "schema": {
    "type": "Article",
    "status": "noindex_repaired_content",
    "framework": "big_five",
    "entity_type": "domain"
  },
  "method_boundary": {
    "summary": "This page explains public Big Five concepts and communication language; it does not interpret an individual assessment or replace professional judgment.",
    "not_for": [
      "clinical diagnosis",
      "therapy advice",
      "hiring screening",
      "ability or intelligence judgment",
      "career or partner decisions"
    ]
  },
  "evidence_notes": [
    "This page follows public Big Five research framing, including BFI-2, five-factor model reviews, IPIP resources, and 30-facet literature.",
    "The material is for trait language and communication reflection, not clinical diagnosis, therapy, hiring screening, ability judgment, or deterministic career choice.",
    "Competitor pages were used only for gap awareness; their structure, examples, and wording were not copied."
  ],
  "internal_links": [
    {
      "label": "Big Five Personality",
      "href": "/en/personality/big-five",
      "relationship": "hub"
    },
    {
      "label": "Big Five test",
      "href": "/en/tests/big-five-personality-test-ocean-model",
      "relationship": "test_landing"
    },
    {
      "label": "30 facets overview",
      "href": "/en/personality/big-five/facets",
      "relationship": "facet_overview"
    },
    {
      "label": "High Openness",
      "href": "/en/personality/big-five/high-openness",
      "relationship": "high_pole"
    },
    {
      "label": "Low Openness",
      "href": "/en/personality/big-five/low-openness",
      "relationship": "low_pole"
    }
  ],
  "source_ledger_refs": [
    "A1",
    "A2",
    "A5",
    "A8",
    "I2",
    "I4"
  ],
  "model_output_refs": [
    "BIG-FIVE-V1-CONTENT-EDITORIAL-REPAIR-01"
  ],
  "last_reviewed_at": "2026-06-15"
}
