{
  "package_id": "big_five:zh-CN:agreeableness:editorial-repair-01",
  "framework": "big_five",
  "entity_type": "domain",
  "code": "agreeableness",
  "locale": "zh-CN",
  "slug": "big-five/agreeableness",
  "title": "宜人性",
  "summary": "宜人性描述信任、合作、共情、边界、冲突和直接性等稳定倾向，帮助理解学习、沟通和适应不同场景的方式。",
  "seo": {
    "title": "宜人性｜大五人格指南",
    "description": "宜人性描述信任、合作、共情、边界、冲突和直接性等稳定倾向，帮助理解学习、沟通和适应不同场景的方式。"
  },
  "canonical": {
    "path": "/zh/personality/big-five/agreeableness"
  },
  "hreflang": {
    "zh-CN": "/zh/personality/big-five/agreeableness",
    "en": "/en/personality/big-five/agreeableness"
  },
  "robots": "noindex,follow",
  "launch_state": "content_ready",
  "index_eligible": false,
  "sitemap_eligible": false,
  "llms_eligible": false,
  "sections": [
    {
      "key": "quick_answer",
      "title": "快速回答",
      "body": "宜人性说明信任、合作、共情、边界、冲突和直接性。它不是类型标签，也不表示能力高低。",
      "evidence_ids": [
        "A1",
        "A5"
      ]
    },
    {
      "key": "definition",
      "title": "这个维度关注什么",
      "body": "宜人性可以理解为偏好语言，用来描述人在选择信息、处理任务和回应他人时的常见节奏。",
      "evidence_ids": [
        "A1",
        "A5"
      ]
    },
    {
      "key": "examples",
      "title": "两个具体例子",
      "body": "冲突时先确认对方处境再表达边界；团队中主动补位但避免承担所有协调成本",
      "evidence_ids": [
        "A1",
        "A5"
      ]
    },
    {
      "key": "daily_signs",
      "title": "日常表现",
      "body": "在日常生活中，宜人性可能体现在如何开始任务、处理反馈、安排变化，以及解释自己的需求。",
      "evidence_ids": [
        "A1",
        "A5"
      ]
    },
    {
      "key": "higher_and_lower",
      "title": "偏高与偏低",
      "body": "偏高表示这些倾向更容易被启动；偏低表示更节制、谨慎或依赖熟悉模式。两端都有可用之处。",
      "evidence_ids": [
        "A1",
        "A5"
      ]
    },
    {
      "key": "strengths_tradeoffs",
      "title": "优势与权衡",
      "body": "宜人性的价值取决于场景。适配时它能带来清晰线索，过度依赖时也可能遮蔽另一端需求。",
      "evidence_ids": [
        "A1",
        "A5"
      ]
    },
    {
      "key": "work_learning",
      "title": "工作与学习",
      "body": "在工作或学习里，宜人性可以帮助描述偏好的任务结构、反馈方式和协作节奏。",
      "evidence_ids": [
        "A1",
        "A5"
      ]
    },
    {
      "key": "relationships",
      "title": "关系与沟通",
      "body": "讨论宜人性时，最好用具体需求代替标签。",
      "evidence_ids": [
        "A1",
        "A5"
      ]
    },
    {
      "key": "misunderstanding",
      "title": "常见误解",
      "body": "宜人性不是善良认证，也不是必须迁就；低一些也不等于冷漠。",
      "evidence_ids": [
        "A1",
        "A5"
      ]
    },
    {
      "key": "action_prompt",
      "title": "行动提示",
      "body": "回想一个最近场景：这个维度帮你解决了什么，又让你忽略了什么？",
      "evidence_ids": [
        "I4"
      ]
    },
    {
      "key": "method_boundary",
      "title": "方法边界",
      "body": "本页只解释宜人性的公共知识，不解释个人结果，不用于诊断、治疗、招聘筛选、能力判断或职业决定。",
      "evidence_ids": [
        "I4"
      ]
    },
    {
      "key": "related_links",
      "title": "继续浏览",
      "body": "继续查看高宜人性、低宜人性和 30 facets overview。",
      "evidence_ids": [
        "I4"
      ]
    }
  ],
  "faq": [
    {
      "id": "agreeableness-meaning",
      "question": "宜人性主要说明什么？",
      "answer": "宜人性说明信任、合作、共情、边界、冲突和直接性等倾向如何在选择和沟通中出现。",
      "evidence_ids": [
        "A1"
      ]
    },
    {
      "id": "agreeableness-poles",
      "question": "偏高或偏低有好坏之分吗？",
      "answer": "没有。偏高和偏低都只是倾向，是否有帮助取决于场景。",
      "evidence_ids": [
        "A5"
      ]
    },
    {
      "id": "agreeableness-observe",
      "question": "怎么观察这个维度？",
      "answer": "观察你在压力、反馈、变化和合作中的反应，而不是只看一次行为。",
      "evidence_ids": [
        "A5"
      ]
    },
    {
      "id": "agreeableness-career",
      "question": "它能决定工作选择吗？",
      "answer": "不能。它可以提供偏好线索，但不能替代能力、经验和机会判断。",
      "evidence_ids": [
        "I4"
      ]
    },
    {
      "id": "agreeableness-facets",
      "question": "它和 facets 有什么关系？",
      "answer": "facets 是这个大维度内部更细的解释层。",
      "evidence_ids": [
        "A8"
      ]
    }
  ],
  "media": {
    "status": "placeholder",
    "image_url": null,
    "alt": "宜人性的大五人格中性占位图，不使用 MBTI 品牌视觉。"
  },
  "schema": {
    "type": "Article",
    "status": "noindex_repaired_content",
    "framework": "big_five",
    "entity_type": "domain"
  },
  "method_boundary": {
    "summary": "本页解释大五人格的公共知识和沟通语言，不解读个人测评结果，也不替代专业判断。",
    "not_for": [
      "临床诊断",
      "心理治疗建议",
      "招聘筛选",
      "能力或智力判断",
      "职业或伴侣关系决定"
    ]
  },
  "evidence_notes": [
    "本页依据大五人格作为连续特质模型的公开研究脉络撰写，参考 BFI-2、五因素模型综述、IPIP 公开量表生态和 30 facets 文献。",
    "这些说明用于理解人格语言和沟通差异，不用于临床诊断、心理治疗、招聘筛选、能力判断或职业决定。",
    "竞品页面只用于发现用户问题和内容缺口，不复制其结构、示例或措辞。"
  ],
  "internal_links": [
    {
      "label": "大五人格",
      "href": "/zh/personality/big-five",
      "relationship": "hub"
    },
    {
      "label": "大五人格测试",
      "href": "/zh/tests/big-five-personality-test-ocean-model",
      "relationship": "test_landing"
    },
    {
      "label": "30 个细分面向",
      "href": "/zh/personality/big-five/facets",
      "relationship": "facet_overview"
    },
    {
      "label": "高宜人性",
      "href": "/zh/personality/big-five/high-agreeableness",
      "relationship": "high_pole"
    },
    {
      "label": "低宜人性",
      "href": "/zh/personality/big-five/low-agreeableness",
      "relationship": "low_pole"
    }
  ],
  "source_ledger_refs": [
    "A1",
    "A2",
    "A5",
    "A8",
    "I2",
    "I4"
  ],
  "model_output_refs": [
    "BIG-FIVE-V1-CONTENT-EDITORIAL-REPAIR-01"
  ],
  "last_reviewed_at": "2026-06-15"
}
