{
  "package_id": "big_five:zh-CN:emotional-stability:editorial-repair-01",
  "framework": "big_five",
  "entity_type": "polarity",
  "code": "emotional-stability",
  "locale": "zh-CN",
  "slug": "big-five/emotional-stability",
  "title": "情绪稳定性",
  "summary": "情绪稳定性描述压力反应相对较低、恢复较快、不易长期维持高唤醒的倾向；它不是优劣判断，而是帮助理解场景适配和沟通策略。",
  "seo": {
    "title": "情绪稳定性｜大五人格指南",
    "description": "情绪稳定性描述压力反应相对较低、恢复较快、不易长期维持高唤醒的倾向；它不是优劣判断，而是帮助理解场景适配和沟通策略。"
  },
  "canonical": {
    "path": "/zh/personality/big-five/emotional-stability"
  },
  "hreflang": {
    "zh-CN": "/zh/personality/big-five/emotional-stability",
    "en": "/en/personality/big-five/emotional-stability"
  },
  "robots": "noindex,follow",
  "launch_state": "content_ready",
  "index_eligible": false,
  "sitemap_eligible": false,
  "llms_eligible": false,
  "sections": [
    {
      "key": "quick_answer",
      "title": "快速回答",
      "body": "情绪稳定性描述压力反应相对较低、恢复较快、不易长期维持高唤醒的倾向；它不是优劣判断，而是帮助理解场景适配和沟通策略。",
      "evidence_ids": [
        "A5"
      ]
    },
    {
      "key": "daily_signs",
      "title": "日常表现",
      "body": "在项目开始或沟通现场，情绪稳定性可能表现为压力反应相对较低，这能带来线索，也需要补充另一端的节奏。",
      "evidence_ids": [
        "A5"
      ]
    },
    {
      "key": "strengths",
      "title": "可能的优势",
      "body": "情绪稳定性在适配场景中可能帮助你更快识别需求、选择节奏或稳定合作方式。",
      "evidence_ids": [
        "A5"
      ]
    },
    {
      "key": "tradeoffs",
      "title": "可能的代价",
      "body": "情绪稳定性不是没有情绪，也不等于心理健康认证；它只说明压力反应和恢复节奏相对不同。 如果只依赖这一端，可能忽略另一端提供的信息。",
      "evidence_ids": [
        "A5"
      ]
    },
    {
      "key": "work_learning",
      "title": "工作与学习",
      "body": "把情绪稳定性转化为具体条件：你需要多少结构、反馈、变化、互动或恢复时间。",
      "evidence_ids": [
        "A5"
      ]
    },
    {
      "key": "relationships",
      "title": "关系与沟通",
      "body": "在关系中，情绪稳定性适合用来解释需求，而不是评价人格。",
      "evidence_ids": [
        "A5"
      ]
    },
    {
      "key": "paired_pole",
      "title": "和另一端一起看",
      "body": "建议同时阅读高神经质 / 高情绪敏感性。高低两端像同一维度的两种调节方式。",
      "evidence_ids": [
        "A5"
      ]
    },
    {
      "key": "misunderstanding",
      "title": "常见误解",
      "body": "情绪稳定性不是没有情绪，也不等于心理健康认证；它只说明压力反应和恢复节奏相对不同。",
      "evidence_ids": [
        "A5"
      ]
    },
    {
      "key": "action_prompt",
      "title": "行动提示",
      "body": "回想一个最近场景：这一端帮你解决了什么？下次可以借用另一端的一小步是什么？",
      "evidence_ids": [
        "I4"
      ]
    },
    {
      "key": "method_boundary",
      "title": "方法边界",
      "body": "本页解释情绪稳定性的公共知识，不解释个人结果，不用于诊断、治疗、招聘筛选、能力判断或职业决定。",
      "evidence_ids": [
        "I4"
      ]
    },
    {
      "key": "related_links",
      "title": "继续浏览",
      "body": "继续查看神经质 / 情绪敏感性、高神经质 / 高情绪敏感性和 30 facets overview。",
      "evidence_ids": [
        "I4"
      ]
    }
  ],
  "faq": [
    {
      "id": "emotional-stability-meaning",
      "question": "情绪稳定性主要是什么意思？",
      "answer": "情绪稳定性表示压力反应相对较低、恢复较快、不易长期维持高唤醒更容易出现在日常选择中。",
      "evidence_ids": [
        "A5"
      ]
    },
    {
      "id": "emotional-stability-better",
      "question": "这代表更好吗？",
      "answer": "不代表。它只是一种倾向，是否有帮助取决于场景和调节方式。",
      "evidence_ids": [
        "A5"
      ]
    },
    {
      "id": "emotional-stability-pair",
      "question": "为什么要看另一端？",
      "answer": "另一端能提醒你可能忽略的需求，例如稳定、探索、边界或恢复。",
      "evidence_ids": [
        "A5"
      ]
    },
    {
      "id": "emotional-stability-work",
      "question": "它能决定我适合什么工作吗？",
      "answer": "不能。它可以帮助描述工作方式偏好，但不能单独决定职业。",
      "evidence_ids": [
        "I4"
      ]
    },
    {
      "id": "emotional-stability-practice",
      "question": "我可以怎么练习？",
      "answer": "选择一个场景，保留这一端的优势，再刻意加入另一端的一小步。",
      "evidence_ids": [
        "I4"
      ]
    }
  ],
  "media": {
    "status": "placeholder",
    "image_url": null,
    "alt": "情绪稳定性的大五人格中性占位图，不使用 MBTI 品牌视觉。"
  },
  "schema": {
    "type": "Article",
    "status": "noindex_repaired_content",
    "framework": "big_five",
    "entity_type": "polarity"
  },
  "method_boundary": {
    "summary": "本页解释大五人格的公共知识和沟通语言，不解读个人测评结果，也不替代专业判断。",
    "not_for": [
      "临床诊断",
      "心理治疗建议",
      "招聘筛选",
      "能力或智力判断",
      "职业或伴侣关系决定"
    ]
  },
  "evidence_notes": [
    "本页依据大五人格作为连续特质模型的公开研究脉络撰写，参考 BFI-2、五因素模型综述、IPIP 公开量表生态和 30 facets 文献。",
    "这些说明用于理解人格语言和沟通差异，不用于临床诊断、心理治疗、招聘筛选、能力判断或职业决定。",
    "竞品页面只用于发现用户问题和内容缺口，不复制其结构、示例或措辞。"
  ],
  "internal_links": [
    {
      "label": "大五人格",
      "href": "/zh/personality/big-five",
      "relationship": "hub"
    },
    {
      "label": "大五人格测试",
      "href": "/zh/tests/big-five-personality-test-ocean-model",
      "relationship": "test_landing"
    },
    {
      "label": "30 个细分面向",
      "href": "/zh/personality/big-five/facets",
      "relationship": "facet_overview"
    },
    {
      "label": "神经质 / 情绪敏感性",
      "href": "/zh/personality/big-five/neuroticism",
      "relationship": "domain"
    },
    {
      "label": "高神经质 / 高情绪敏感性",
      "href": "/zh/personality/big-five/high-neuroticism",
      "relationship": "paired_pole"
    }
  ],
  "source_ledger_refs": [
    "A1",
    "A5",
    "I2",
    "I4"
  ],
  "model_output_refs": [
    "BIG-FIVE-V1-CONTENT-EDITORIAL-REPAIR-01"
  ],
  "last_reviewed_at": "2026-06-15"
}
